{
  "schema_version": "0.1.0",
  "effective_from": "2026-08-05",
  "status": "draft",

  "type_chart": {
    "electric": { "steel": 1.5, "earth": 0.75 },
    "fire":     { "steel": 1.5, "earth": 0.75 },
    "steel":    { "wind": 1.5, "electric": 0.75, "fire": 0.75 },
    "wind":     { "grass": 1.5, "steel": 0.75 },
    "grass":    { "water": 1.5, "wind": 0.75 },
    "water":    { "earth": 1.5, "grass": 0.75 },
    "earth":    { "electric": 1.5, "fire": 1.5, "water": 0.75 },
    "gold":     { "psychic": 1.5 },
    "psychic":  { "gold": 1.5 }
  },

  "rarity_tiers": {
    "mythical":  { "bst": 600, "count": 1,  "encounter_base_rate": 0.005, "capture_base_rate": 0.02, "growth_group": "slow" },
    "legendary": { "bst": 540, "count": 3,  "encounter_base_rate": 0.02,  "capture_base_rate": 0.05, "growth_group": "slow" },
    "epic":      { "bst": 500, "count": 7,  "encounter_base_rate": 0.08,  "capture_base_rate": 0.12, "growth_group": "medium" },
    "rare":      { "bst": 460, "count": 15, "encounter_base_rate": 0.25,  "capture_base_rate": 0.25, "growth_group": "medium" },
    "common":    { "bst": 420, "count": 24, "encounter_base_rate": 0.645, "capture_base_rate": 0.45, "growth_group": "fast" }
  },

  "iv": {
    "max": 30,
    "ranges": {
      "surge":  { "min": 15, "max": 30 },
      "normal": { "min": 5,  "max": 25 },
      "weak":   { "min": 0,  "max": 15 }
    },
    "star_thresholds": [0, 7, 13, 20, 26]
  },

  "weather_effects": {
    "excited":   { "crit_rate": 0.25 },
    "tailwind":  { "hp": 1.05, "atk": 1.05, "matk": 1.05, "def": 1.05, "mdef": 1.05, "spd": 1.05 },
    "depressed": { "atk": 0.95, "matk": 0.95, "def": 0.95, "mdef": 0.95, "spd": 0.95 }
  },

  "world_weather_effects": {
    "sunny":  { "atk": 1.03, "matk": 1.03 },
    "normal": {},
    "storm":  {}
  },

  "kd_shield": {
    "period": 9,
    "damage_taken": 0.85
  },

  "net_value_shield": {
    "pb_threshold": 1.5,
    "gold_threshold": 1.0,
    "amount_formula_k": 0.5,
    "blocks_crit": true
  },

  "capture": {
    "price_multiplier": 10,
    "state_modifiers": { "surge": 0.7, "normal": 1.0, "weak": 1.3 },
    "balls": [
      { "id": "market_ball",  "name": "市價球",   "real_world": "市價單（不計成本先買到）",     "rate_multiplier": 1.5,  "price": 3000, "rarity_limit": null },
      { "id": "limit_ball",   "name": "限價球",   "real_world": "限價單（指定價慢慢等）",       "rate_multiplier": 1.0,  "price": 1000, "rarity_limit": null },
      { "id": "odd_lot_ball", "name": "零股球",   "real_world": "零股交易（小資入場）",         "rate_multiplier": 0.7,  "price": 300,  "rarity_limit": ["common"] },
      { "id": "master_ball",  "name": "大師球",   "real_world": "鉅額交易／盤後定價",           "rate_multiplier": 1.0, "guaranteed": true, "price": 0, "rarity_limit": null }
    ]
  },

  "hospital": {
    "daily_uses": 5,
    "fee_by_eps_percentile": [
      { "min_percentile": 0,  "fee": 200 },
      { "min_percentile": 40, "fee": 500 },
      { "min_percentile": 70, "fee": 1200 },
      { "min_percentile": 90, "fee": 3000 }
    ],
    "hyper_evolution_multiplier": 3
  },

  "leveling": {
    "max_level": 50,
    "base_exp": 8,
    "group_coefficient": { "slow": 1.3, "medium": 1.0, "fast": 0.8 },
    "rested_bonus": { "max_days": 10, "multiplier": 2 }
  },

  "battle": {
    "base_crit_rate": 0.1,
    "crit_multiplier": 1.5,
    "level_coefficient_k": 0.02,
    "max_moves": 4
  }
}
